{
    "notes": "Generated using list_json: 'Meta' (1.59.0) - simulates Quest 3",
    "$schema": "../schema.json",
    "name": "Meta XR Simulator",
    "conformance_submission": 30,
    "platform": "Windows (Desktop)",
    "vendor": "Meta Platforms",
    "extensions": [
        "XR_KHR_composition_layer_cylinder",
        "XR_KHR_composition_layer_depth",
        "XR_KHR_convert_timespec_time", 
        "XR_KHR_D3D11_enable", 
        "XR_KHR_D3D12_enable",
        "XR_KHR_vulkan_enable",
        "XR_KHR_vulkan_enable2",
        "XR_KHR_win32_convert_performance_counter_time",
        "XR_EXT_conformance_automation",
        "XR_EXT_debug_utils",
        "XR_EXT_hand_tracking",
        "XR_FB_body_tracking",
        "XR_FB_display_refresh_rate",
        "XR_FB_face_tracking",
        "XR_FB_hand_tracking_mesh",
        "XR_FB_passthrough",
        "XR_FB_render_model",
        "XR_FB_scene",
        "XR_FB_space_warp",
        "XR_FB_spatial_entity_container",
        "XR_FB_spatial_entity_query",
        "XR_FB_spatial_entity_sharing",
        "XR_FB_spatial_entity_storage_batch",
        "XR_FB_spatial_entity_storage",
        "XR_FB_spatial_entity_user",
        "XR_FB_spatial_entity",
        "XR_FB_touch_controller_pro",
        "XR_FB_triangle_mesh",
        "XR_META_headset_id",
        "XR_OCULUS_audio_device_guid"
    ],
    "form_factors": [
        {
            "form_factor": "XR_FORM_FACTOR_HEAD_MOUNTED_DISPLAY",
            "view_configurations": [
                {
                    "view_configuration": "XR_VIEW_CONFIGURATION_TYPE_PRIMARY_STEREO",
                    "environment_blend_modes": [
                        "OPAQUE"
                    ]
                }
            ]
        }
    ]
}
