{
    "$schema": "../schema.json",
    "name": "Meta Quest / Quest 2 (Mobile)",
    "conformance_submission": 4,
    "platform": "Android (All-in-one)",
    "vendor": "Meta Platforms",
    "extensions": [
        "XR_KHR_android_create_instance",
        "XR_KHR_android_surface_swapchain",
        "XR_KHR_android_thread_settings",
        "XR_KHR_composition_layer_color_scale_bias",
        "XR_KHR_composition_layer_cube",
        "XR_KHR_composition_layer_cylinder",
        "XR_KHR_composition_layer_depth",
        "XR_KHR_composition_layer_equirect2",
        "XR_KHR_convert_timespec_time",
        "XR_KHR_opengl_es_enable",
        "XR_KHR_vulkan_enable",
        "XR_KHR_vulkan_enable2",
        "XR_EXT_hand_tracking",
        "XR_EXT_performance_settings",
        "XR_FB_color_space",
        "XR_FB_composition_layer_alpha_blend",
        "XR_FB_composition_layer_image_layout",
        "XR_FB_composition_layer_secure_content",
        "XR_FB_display_refresh_rate",
        "XR_FB_foveation",
        "XR_FB_foveation_configuration",
        "XR_FB_foveation_vulkan",
        "XR_FB_hand_tracking_aim",
        "XR_FB_hand_tracking_capsules",
        "XR_FB_hand_tracking_mesh",
        "XR_FB_keyboard_tracking",
        "XR_FB_passthrough",
        "XR_FB_passthrough_keyboard_hands",
        "XR_FB_render_model",
        "XR_FB_space_warp",
        "XR_FB_swapchain_update_state",
        "XR_FB_swapchain_update_state_android_surface",
        "XR_FB_swapchain_update_state_opengl_es",
        "XR_FB_swapchain_update_state_vulkan",
        "XR_FB_triangle_mesh"
    ]
}
