{
    "notes": "Generated using list_json: 'Monado(XRT) by Collabora et al 'v24.0.0-367-g3009f3750'' (24.0.0)",
    "$schema": "../schema.json",
    "name": "Monado (Android)",
    "vendor": "Monado Community + Collabora, Ltd.",
    "platform": "Android (Phone/Installable)",
    "conformance_notes": "Only the 'Simulated Device' in Monado on Linux is officially conformant. Vendors building on Monado must follow the normal conformance process for their own devices.",
    "notes": "Could be built-in to an all-in-one, but Collabora does not manufacture or have system-level access to such devices. Availability of some extensions is determined by availability of dependencies at compile time. Support for some extensions and blend modes depends on the hardware in use.",
    "extensions": [
        "XR_KHR_android_create_instance",
        "XR_KHR_android_thread_settings",
        "XR_KHR_binding_modification",
        "XR_KHR_composition_layer_cylinder",
        "XR_KHR_composition_layer_depth",
        "XR_KHR_composition_layer_equirect2",
        "XR_KHR_convert_timespec_time",
        "XR_KHR_loader_init",
        "XR_KHR_loader_init_android",
        "XR_KHR_locate_spaces",
        "XR_KHR_maintenance1",
        "XR_KHR_opengl_es_enable",
        "XR_KHR_swapchain_usage_input_attachment_bit",
        "XR_KHR_visibility_mask",
        "XR_KHR_vulkan_enable",
        "XR_KHR_vulkan_enable2",
        "XR_KHR_vulkan_swapchain_format_list",
        "XR_EXT_active_action_set_priority",
        "XR_EXT_dpad_binding",
        "XR_EXT_eye_gaze_interaction",
        "XR_EXT_hand_interaction",
        "XR_EXT_hand_tracking",
        "XR_EXT_hp_mixed_reality_controller",
        "XR_EXT_local_floor",
        "XR_EXT_samsung_odyssey_controller",
        "XR_EXTX_overlay",
        "XR_BD_controller_interaction",
        "XR_FB_display_refresh_rate",
        "XR_FB_touch_controller_pro",
        "XR_FB_touch_controller_proximity",
        "XR_HTC_vive_cosmos_controller_interaction",
        "XR_HTC_vive_focus3_controller_interaction",
        "XR_META_touch_controller_plus",
        "XR_ML_ml2_controller_interaction",
        "XR_MND_headless",
        "XR_MND_swapchain_usage_input_attachment_bit",
        "XR_MNDX_force_feedback_curl",
        "XR_MSFT_unbounded_reference_space",
        "XR_OPPO_controller_interaction"
    ],
    "form_factors": [
        {
            "form_factor": "XR_FORM_FACTOR_HEAD_MOUNTED_DISPLAY",
            "view_configurations": [
                {
                    "view_configuration": "XR_VIEW_CONFIGURATION_TYPE_PRIMARY_STEREO",
                    "environment_blend_modes": [
                        "OPAQUE",
                        "ADDITIVE"
                    ]
                }
            ]
        }
    ]
}
