{
    "$schema": "../schema.json",
    "name": "HTC Vive Cosmos",
    "conformance_submission": 13,
    "platform": "Windows (Desktop)",
    "vendor": "HTC America, Inc.",
    "extensions": [
        "XR_KHR_composition_layer_depth",
        "XR_KHR_convert_timespec_time",
        "XR_KHR_D3D11_enable",
        "XR_KHR_D3D12_enable",
        "XR_KHR_opengl_enable",
        "XR_KHR_visibility_mask",
        "XR_KHR_vulkan_enable",
        "XR_KHR_vulkan_enable2",
        "XR_KHR_win32_convert_performance_counter_time",
        "XR_EXT_eye_gaze_interaction",
        "XR_EXT_hand_joints_motion_range",
        "XR_EXT_hand_tracking",
        "XR_EXT_win32_appcontainer_compatible",
        "XR_FB_passthrough",
        "XR_FB_triangle_mesh",
        "XR_HTC_facial_tracking",
        "XR_HTC_vive_cosmos_controller_interaction",
        "XR_MSFT_scene_understanding"
    ],
    "form_factors": [
        {
            "form_factor": "XR_FORM_FACTOR_HEAD_MOUNTED_DISPLAY",
            "view_configurations": [
                {
                    "view_configuration": "XR_VIEW_CONFIGURATION_TYPE_PRIMARY_STEREO",
                    "environment_blend_modes": [
                        "OPAQUE",
                        "ALPHA_BLEND"
                    ]
                }
            ]
        }
    ]
}
