{
    "$schema": "../schema.json",
    "name": "Bytedance PICO 4 / PICO 4 Ultra / PICO Neo3",
    "conformance_submission": 25,
    "platform": "Android (All-in-one)",
    "vendor": "BYTEDANCE",
    "extensions": [
        "XR_KHR_android_create_instance",
        "XR_KHR_android_surface_swapchain",
        "XR_KHR_composition_layer_color_scale_bias",
        "XR_KHR_composition_layer_cube",
        "XR_KHR_composition_layer_cylinder",
        "XR_KHR_composition_layer_equirect",
        "XR_KHR_composition_layer_equirect2",
        "XR_KHR_convert_timespec_time",
        "XR_KHR_loader_init",
        "XR_KHR_loader_init_android",
        "XR_KHR_opengl_es_enable",
        "XR_KHR_vulkan_enable",
        "XR_KHR_vulkan_enable2",
        "XR_KHR_vulkan_swapchain_format_list",
        "XR_MND_headless",
        "XR_EPIC_view_configuration_fov",
        "XR_EXT_debug_utils",
        "XR_EXT_eye_gaze_interaction",
        "XR_EXT_hand_tracking",
        "XR_EXT_view_configuration_depth_range",
        "XR_EXT_performance_settings",
        "XR_EXTX_overlay",
        "XR_FB_composition_layer_alpha_blend",
        "XR_FB_composition_layer_image_layout",
        "XR_FB_composition_layer_secure_content",
        "XR_FB_composition_layer_settings",
        "XR_FB_display_refresh_rate",
        "XR_FB_foveation",
        "XR_FB_foveation_configuration",
        "XR_FB_foveation_vulkan",
        "XR_FB_passthrough",
        "XR_FB_swapchain_update_state",
        "XR_FB_triangle_mesh",
        "XR_FB_space_warp",
        "XR_FB_swapchain_update_state_android_surface",
        "XR_FB_swapchain_update_state_opengl_es",
        "XR_FB_swapchain_update_state_vulkan",
        "XR_META_foveation_eye_tracked",
        "XR_META_vulkan_swapchain_create_info"
    ],
    "form_factors": [
        {
            "form_factor": "XR_FORM_FACTOR_HEAD_MOUNTED_DISPLAY",
            "view_configurations": [
                {
                    "view_configuration": "XR_VIEW_CONFIGURATION_TYPE_PRIMARY_STEREO",
                    "environment_blend_modes": [
                        "OPAQUE"
                    ]
                }
            ]
        }
    ]
}
