{
    "$schema": "../schema.json",
    "name": "Monado 21.0.0 / Qualcomm Retina 1.0.0 (Snapdragon 840/865/888)",
    "conformance_submission": 16,
    "vendor": "QUALCOMM",
    "extensions": [
        "XR_KHR_android_create_instance",
        "XR_KHR_composition_layer_cylinder",
        "XR_KHR_composition_layer_equirect",
        "XR_KHR_convert_timespec_time",
        "XR_KHR_loader_init",
        "XR_KHR_loader_init_android",
        "XR_KHR_opengl_es_enable",
        "XR_KHR_swapchain_usage_input_attachment_bit",
        "XR_KHR_vulkan_enable",
        "XR_KHR_vulkan_enable2",
        "XR_EXT_debug_utils",
        "XR_EXT_hand_tracking",
        "XR_MND_headless",
        "XR_EXTX_overlay"
    ],
    "form_factors": [
        {
            "form_factor": "XR_FORM_FACTOR_HEAD_MOUNTED_DISPLAY",
            "view_configurations": [
                {
                    "view_configuration": "XR_VIEW_CONFIGURATION_TYPE_PRIMARY_STEREO",
                    "environment_blend_modes": [
                        "OPAQUE"
                    ]
                }
            ]
        }        
    ]
}
