{
    "$schema": "../schema.json",
    "name": "Monado (Windows)",
    "vendor": "Monado Community + Collabora, Ltd.",
    "platform": "Windows (Desktop)",
    "conformance_notes": "Only the 'Simulated Device' in Monado on Linux is officially conformant. Vendors building on Monado must follow the normal conformance process for their own devices.",
    "notes": "Availability of some extensions is determined by availability of dependencies at compile time.",
    "extensions": [
        "XR_KHR_composition_layer_cube",
        "XR_KHR_composition_layer_cylinder",
        "XR_KHR_composition_layer_depth",
        "XR_KHR_composition_layer_equirect",
        "XR_KHR_composition_layer_equirect2",
        "XR_KHR_convert_timespec_time",
        "XR_KHR_win32_convert_performance_counter_time",
        "XR_KHR_D3D11_enable",
        "XR_KHR_swapchain_usage_input_attachment_bit",
        "XR_KHR_vulkan_enable",
        "XR_KHR_vulkan_enable2",
        "XR_EXT_hand_tracking",
        {
            "name": "XR_FB_display_refresh_rate",
            "notes": "Not useful on all drivers"
        },
        "XR_MND_headless",
        "XR_MND_swapchain_usage_input_attachment_bit"
    ],
    "form_factors": [
        {
            "form_factor": "XR_FORM_FACTOR_HEAD_MOUNTED_DISPLAY",
            "view_configurations": [
                {
                    "view_configuration": "XR_VIEW_CONFIGURATION_TYPE_PRIMARY_STEREO",
                    "environment_blend_modes": [
                        "OPAQUE",
                        "ADDITIVE"
                    ]
                }
            ]
        }
    ]
}
