{
    "$schema": "../schema.json",
    "name": "Magic Leap Remote Rendering",
    "conformance_submission": 27,
    "form_factors": [
        {
            "form_factor": "XR_FORM_FACTOR_HEAD_MOUNTED_DISPLAY",
            "view_configurations": [
                {
                    "view_configuration": "XR_VIEW_CONFIGURATION_TYPE_PRIMARY_STEREO",
                    "environment_blend_modes": [
                        "ADDITIVE",
                        "ALPHA_BLEND"
                    ]
                }
            ]
        }
    ],
    "platform": "Windows (Desktop)",
    "vendor": "Magic Leap",
    "updated": "November 13, 2023",
    "extensions": [
		"XR_EXT_dpad_binding",
		"XR_EXT_eye_gaze_interaction",
		"XR_EXT_hand_interaction",
		"XR_EXT_hand_tracking",
		"XR_EXT_plane_detection",
		"XR_KHR_D3D11_enable",
		"XR_KHR_D3D12_enable",
		"XR_KHR_composition_layer_cylinder",
		"XR_KHR_composition_layer_depth",
		"XR_KHR_composition_layer_equirect2",
		"XR_KHR_opengl_enable",
		"XR_KHR_vulkan_enable",
		"XR_KHR_vulkan_enable2",
		"XR_KHR_win32_convert_performance_counter_time",
		"XR_ML_global_dimmer",
		"XR_ML_ml2_controller_interaction",
		"XR_KHR_binding_modification",
		"XR_MND_swapchain_usage_input_attachment_bit",
		"XR_KHR_swapchain_usage_input_attachment_bit",
		"XR_EXT_debug_utils"
    ]
}
