{
    "notes": "Generated using list_json: 'SteamVR/OpenXR' (0.1.0)",
    "$schema": "../schema.json",
    "name": "SteamVR",
    "conformance_submission": 11,
    "platform": "Windows (Desktop)",
    "vendor": "Valve Corporation",
    "extensions": [
        "XR_KHR_binding_modification",
        "XR_KHR_composition_layer_depth",
        "XR_KHR_D3D11_enable",
        "XR_KHR_D3D12_enable",
        "XR_KHR_opengl_enable",
        "XR_KHR_visibility_mask",
        "XR_KHR_vulkan_enable",
        "XR_KHR_vulkan_enable2",
        "XR_KHR_win32_convert_performance_counter_time",
        "XR_EXT_dpad_binding",
        "XR_EXT_hand_joints_motion_range",
        "XR_EXT_hand_tracking",
        "XR_EXT_hp_mixed_reality_controller",
        "XR_EXT_palm_pose",
        "XR_EXT_win32_appcontainer_compatible",
        "XR_FB_display_refresh_rate",
        "XR_HTC_vive_cosmos_controller_interaction",
        "XR_HTC_vive_focus3_controller_interaction",
        "XR_HTCX_vive_tracker_interaction",
        "XR_MND_headless",
        "XR_VALVE_analog_threshold"
    ],
    "form_factors": [
        {
            "form_factor": "XR_FORM_FACTOR_HEAD_MOUNTED_DISPLAY",
            "view_configurations": [
                {
                    "view_configuration": "XR_VIEW_CONFIGURATION_TYPE_PRIMARY_STEREO",
                    "environment_blend_modes": [
                        "OPAQUE"
                    ]
                }
            ]
        }
    ]
}
