{
    "notes": "Generated using list_json: 'VIVE WAVE' (0.0.1)",
    "$schema": "../schema.json",
    "name": "HTC Vive Focus 3",
    "conformance_submission": 21,
    "platform": "Android (All-in-one)",
    "vendor": "HTC America, Inc.",
    "extensions": [
        "XR_KHR_android_create_instance",
        "XR_KHR_android_surface_swapchain",
        "XR_KHR_composition_layer_color_scale_bias",
        "XR_KHR_composition_layer_cylinder",
        "XR_KHR_composition_layer_equirect",
        "XR_KHR_composition_layer_equirect2",
        "XR_KHR_convert_timespec_time",
        "XR_KHR_loader_init",
        "XR_KHR_loader_init_android",
        "XR_KHR_opengl_es_enable",
        "XR_KHR_visibility_mask",
        "XR_KHR_vulkan_enable",
        "XR_KHR_vulkan_enable2",
        "XR_EXT_eye_gaze_interaction",
        "XR_EXT_future",
        "XR_EXT_hand_interaction",
        "XR_EXT_hand_tracking",
        "XR_EXT_palm_pose",
        "XR_EXT_performance_settings",
        "XR_EXT_plane_detection",
        "XR_EXT_user_presence",
        "XR_FB_display_refresh_rate",
        "XR_FB_keyboard_tracking",
        "XR_HTC_anchor",
        "XR_HTC_facial_tracking",
        "XR_HTC_foveation",
        "XR_HTC_hand_interaction",
        "XR_HTC_passthrough",
        "XR_HTC_vive_focus3_controller_interaction",
        "XR_HTC_vive_wrist_tracker_interaction",
        "XR_MSFT_first_person_observer",
        "XR_MSFT_secondary_view_configuration"
    ],
    "form_factors": [
        {
            "form_factor": "XR_FORM_FACTOR_HEAD_MOUNTED_DISPLAY",
            "view_configurations": [
                {
                    "view_configuration": "XR_VIEW_CONFIGURATION_TYPE_PRIMARY_STEREO",
                    "environment_blend_modes": [
                        "OPAQUE"
                    ]
                }
            ]
        }
    ]
}
