{
    "$schema": "../schema.json",
    "name": "Windows Mixed Reality",
    "conformance_submission": 1,
    "platform": "Windows (Desktop)",
    "notes": "Also for HoloLens 2 all-in-one",
    "vendor": "Microsoft Corporation",
    "extensions": [
        "XR_KHR_composition_layer_color_scale_bias",
        "XR_KHR_composition_layer_depth",
        "XR_KHR_D3D11_enable",
        "XR_KHR_D3D12_enable",
        "XR_KHR_visibility_mask",
        "XR_KHR_win32_convert_performance_counter_time",
        "XR_EXT_conformance_automation",
        "XR_EXT_eye_gaze_interaction",
        "XR_EXT_hand_joints_motion_range",
        "XR_EXT_hand_tracking",
        "XR_EXT_hp_mixed_reality_controller",
        "XR_EXT_samsung_odyssey_controller",
        "XR_EXT_win32_appcontainer_compatible",
        "XR_MSFT_composition_layer_reprojection",
        "XR_MSFT_controller_model",
        "XR_MSFT_first_person_observer",
        "XR_MSFT_hand_interaction",
        "XR_MSFT_hand_tracking_mesh",
        "XR_MSFT_holographic_window_attachment",
        "XR_MSFT_perception_anchor_interop",
        "XR_MSFT_scene_understanding",
        "XR_MSFT_scene_understanding_serialization",
        "XR_MSFT_secondary_view_configuration",
        "XR_MSFT_spatial_anchor",
        "XR_MSFT_spatial_anchor_persistence",
        "XR_MSFT_spatial_graph_bridge",
        "XR_MSFT_unbounded_reference_space"
    ]
}
